post_id,subreddit,comment_text,symptom ,Y
135,r/PelvicFloor, I noticed that I was constantly feeling the urge to urinate and that it did not go away even after peeing,"urinary frequency, urinary urgency",0
136,r/Ureaplasma," I’m dealing with extreme fatigue, muscle weakness, lower back and pelvic pain,","fatigue, lower back pain, pelvic pain",0
137,r/GERD,"causes severe fatigue, nausea so bad it blurs vision, leg pain, on and on.","farigue, nausea, leg pain",0
138,r/GERD,", especially the dizziness, migraines and soreness all over.","dizziness , migraine",0
139,r/GERD,It's usually bloating for me. If i ate foods that cause gas I'll experience bloating and it pushes my stomach so the acid backs up easily up the throat,bloating.,0
140,r/GERD,"long-lasting pain; lots of gas and rumbling; constant bloating; nausea but can’t seem to vomit, like my gag reflex is broken,","gas, bloating, nausea",0
141,r/GERD,"stomach pain, bloating/diarrhea/constipation. I had zero energy and a VERY BAD brain fog","stomach pain, bloating, constipation, diarrhea, brain fog",0
142,r/GERD,The dizziness symptoms from GERD is pretty annoying.,dizziness ,0
143,r/fibromyalgia,Sometimes I wake up feeling so fatigued that I want to go back to sleep in spite of having nightmares all night.,fatigue,0
144,r/endometriosis,intense pain during/after inter course that started me on my whole endo journey.,painful intercourse,1
145,r/endometriosis,"I’ve been suffering with gynae issues including heavy bleeding, severe cramping since I around 14/15.",heavy bleeding and cramps,1
146,r/endometriosis, My abdomen and thighs are radiating pain and constant cramps/sharp stabs.,"abdomen pain, thigh pain",1
147,r/endometriosis,"'ve been in absolutely awful pain since yesterday. All centred around my left pelvis - I'm talking cramps that are coupled with sciatic pain radiating down legs and up to my mid back, nausea","pelvic pain, sciatica, leg pain, back pain, nausea",1
148,r/endometriosis,Feeling pain radiate down my leg,leg pain,1
149,r/endometriosis,I have had left abdominal pain for almost 2 years. Now it is starting to radiate down my left leg. I do get pain down my thigh when cramping on my period but this pain is different.,"abdominal pain, leg pain, thigh pain",1
150,r/endometriosis,"Left side pelvic pain, radiates down my left leg, while for me period cramp leg pain is more in the inside of my thighs.","pelvic pain, leg pain, thigh pain",1
151,r/endometriosis,", I am cramping sooooooo bad. Like BAD BAD, like right after my procedure bad. Radiating down my legs, etc.",leg pain,1
152,r/endometriosis,chronic radiating pain starting in their pelvis which shoots down the legs all the way to the feet. Paired with major lower abdominal bloating and tenderness…,"pelvic pain, leg pain, bloating",1
153,r/endometriosis,I was sitting down and five minutes ago my lower back pain started radiating up my back and I couldn't move,back pain,1
154,r/endometriosis,"The last two days I’ve felt an insane amount of pain that’s central pelvic, both sides lower abdo radiating into my back.","pelvic pain, abdomen pain, back pain",1
155,r/endometriosis,"My period cramps are not just uncomfortable, they’re disabling.",period cramps,1
156,r/endometriosis,"Yes! The pain and the fatigue is extreme. It goes all the way down my legs, and up my back. ","fatigue, leg pain, back pain",1
157,r/endometriosis,vomiting/nausea before ovulation,"vomitting, nausea",1
158,r/endometriosis,"had my first period at 13, and it was always very heavy and very very painful. There were times when my cramps are so bad that I need to vomit, or feeling that I needed to pass out. These symptoms were pretty consistent every period and the pain was debilitating.","painful periods, vomit",1
159,r/endometriosis,"Worsened fatigue, horrible bloat that makes my stomach hard, constipation and diarrhea combined, pain (lately I feel it more in my back), sometimes nausea","bloating, constipation, diarrhea, back pain, nausea",1
160,r/endometriosis,my flare ups range from dull pelvic pain to severe bowel/pelvic pain. ,pelvic pain,1
161,r/endometriosis,it was 9/10 pain like a ball of knives had been doused in kerosene and lit and twisted in my abdomen,abdomen pain.,1
162,r/endometriosis,my pelvic pain is so bad I feel like: my insides are being eaten alive,pelvic pain,1
163,r/endometriosis,I feel like I’m being split in two with an axe (in between my legs),pelvic pain,1
164,r/endometriosis,hot lava is moving through my insides and I am also be scraped and poked by a rusty knife.,period cramps,1
165,r/endometriosis,"My analogy for the fatigue is this... It's like you're trying to fill up the bathtub, but someone keeps opening the drain. No matter how much sleep you get its not enough",fatigue,1
166,r/endometriosis,Cramps that feel like someone is scraping my abdomen with a serrated knife.,period cramps,1