post_id,subreddit,comment_text,symptom ,Y
1,r/endometriosis,Every single GI issue under the sun. It was bowel endo. Also my back pain and lumbar pain was uterosacral and spinal endo so that was fun. ,GI issues; bowel issues; back and lumbar pain,1
2,r/endometriosis,"Pain radiating to my upper thighs during my period. Lower back pain during my period. Constant nausea and vomiting during that time, random shooting vaginal pain, migraines leading up to menstruation.", thigh pain; lower back pain ; nausea and vomitting; vaginal pain; migraines,1
3,r/endometriosis,"Extremely painful periods, mostly just the first 2-3 days. Nausea, vommiting, bloating, painful poops all just on the first 1-2 days of my period. My period lasted 7 days and was mostly on schedule give or take 2-4 days. I have gi issues too, but that may be due to other reasons. Bloating all the time became a new thing for me this year.",painful periods; nausea and vomitting; gi issues; bloating,1
4,r/endometriosis,"Allllllll of the GI issues. I thought I had tons of food sensitivities and it turned out to all be endometriosis related. Chronic, crippling lower back pain, especially during my cycle. Pelvic pain, cervicitis, urinary incontinence, bowel issues. All of it was endometriosis.",gi issues; chronic lower back pain; pelvic pain; cervitics; urinary incontience; bowel issues,1
5,r/endometriosis,"IBS / diarrhea, Painful, heavy periods, Extreme cramping that wraps into my back, Deep, throbbing aches in my thighs ",diarrhea; painful and heavy periods; back pain and thigh pain,1
6,r/endometriosis,"cystitis, chronic mock uti flareups, chronic lifelong constipation, ectremely heavy flow that was impossible to keep up with, IBS, constant digestive issues and pain, ovarian cys","cystitis, uti constipation, heavy period, IBS and GI issues, ovarian cysts",1
7,r/endometriosis,extreme fatigue was my first sign something was super wrong. I had pain and stuff too. But the fatigue from being inflamed and in pain all the time is like no other. I told people it’s like someone filled my body with concrete,fatigue,1
8,r/endometriosis,I had to pee ALL OF THE TIME. My endo was so severe it had gotten onto my bladder. I had to pee like every 30-60 minutes. It was like having a uti.,uti,1
9,r/endometriosis,random vaginal pain,vaginal pain,1
10,r/endometriosis,"Chronic abdominal/pelvic pain everyday that felt different from period cramps, almost like chronic indigestion/food poisoning.",abdominal and pelvic pain,1
11,r/endometriosis,Fatigue. My god so much fatigu,fatigue,1
12,r/endometriosis,Fatigue—I feel so much more energetic even a year after my surgery.,fatigue,1
13,r/endometriosis,"lower back pain that never went away, it was always with me. Another symptom was painful intercourse ( I thought it was normal too). I had nausea, gastroentestinal issues, such as upper stomach cramps and really bad bowel movements that give pain (i have endometriosis on my bowel)","lower back pain; painful intercourse; gi issues, bowel issues",1
14,r/endometriosis,"Peeing extremely often, especially during my period and especially at night.",uti,1
15,r/endometriosis,Diarrhea and pain when going even peeing while on my periods.,diarrhea; pain while peeing,1
16,r/endometriosis,"GI issues (constipation, nausea, etc), always chalked them up to ibs or my gastroparesis. Extreme pelvic, back, hip, and thigh pain during my period. Heavy bleeding with lots of clots during my period. Sometimes I bleed for a month straight but was told everything was fine when it first happened at 19. Shooting pains in my crotch & butthole. Spotting for like a week before and after my period. Deep excruciating pain during sex sometimes and occasional cramping after orgasms. And just random pelvic/lower abdominal pains","gi issues; constipation; nausea; pelvic pain, hip pain, back pain, thigh pain, heavy and long bleeding, abdomen pain, painful intercourse",1
17,r/endometriosis,Excruciating hip pain and leg weakness,hip pain and leg weakness,1
18,r/endometriosis,Massive GI issues- often would flit from constipation to diarrhoea in the month.,constipation and diarrhea,1
19,r/endometriosis,"The lower back pain but also my migraines, every month either right before or immediately after my cycle. ","lower back pain, migraine",1
20,r/endometriosis,Difficulty pooping and the constant bloating. Pain during sex. ,"constipation, bloating, painful intercourse",1
21,r/endometriosis,"The fatigue. It was crazy how tired I’d get. Also, to echo a lot in this post, GI issues. ","fatigue, gi issues",1
22,r/endometriosis,"So much constipation, felt like the poop couldn’t fit coming out of me. Often felt like I needed to pee but would struggle to push it out. These aching “pangs” in my pelvis that felt so deep and it would hurt to stand","constipation, struggle peeing, pelvic pain",1
23,r/endometriosis,"Extreme fatigue, brain fog, bowel & bladder issues. I","fatigue, brain fog, gi issues",1
24,r/endometriosis,Excruciating hip pain. Literally feels like my hips are on fire all the time.,hip pain and leg weakness,1
25,r/endometriosis,constipation,constipation,1
26,r/endometriosis,"Bowel issues, deep pain with PIV intercourse, random sharp pelvic pain, constant bloating, extremely heavy bleeding…18 years of symptoms before laparoscopic surgery and diagnosis of Stage 4 Endo.","bowel issues, painful intercourse, pelvic pain, bloating, heavy bleeding",1
27,r/endometriosis,scatica,scatica,1
28,r/endometriosis,"before surgery, I had extremely bad hip pain and sciatica, and after it’s been an 80% improvement. It’s insane how much better it is.","hip pain, scatica",1
29,r/endometriosis,"gastro issues and low grade fever but especially the low grade fever. it drove me insane not knowing what it was, went to multiple doctors and specialists who all couldn‘t find anything before i was diagnosed with end",gi issues and fever,1
30,r/endometriosis,"Definitely GI symptoms, deep pain with penetrative sex, and urinary tract pain are probably the biggest!!","gi issues, painful intercourse, urinary tract pain",1
31,r/endometriosis,"Constipation, bowel movements once a week. Then diarrhea during periods. Frequent UTIs- everytime I had sex, constant brown spotting between periods. Chest pain, shortness of breath, tachycardia ""anxiety"" symptoms. Leg pain, lower back pain. Feeling like I was giving birth when I did pass a bowel movement. Bleeding during and after sex.","constipation and diarrhea, leg pain, lower back pain",1
32,r/endometriosis,"The classics - heavy periods, painful intercourse, fatigue (wayyyy more than most realise), GI issues, sensitivity to foods.","heavy period, painful intercourse, fatigue, gi issues",1
33,r/endometriosis,"lower back pain, chronic fatigue","lower back pain, chronic fatigue",1
34,r/endometriosis,Felt like I was being stabbed in my stomach and my intestines being churned by a knife for couple days before my period. Usually only in the morning. Once I got my period there was no pain. B,pms,1
35,r/endometriosis,"r heavy and abnormal periods, and would throw up almost everyday. It took 3 years for them to even consider it. If you experience dizziness, nausea, vomiting, change in stool, sever cramps that radiate to the back, or pain during any intercourse or spotting get seen"," heavy period, vomitting, nausea, cramps, painful intercouirse",1
36,r/endometriosis,I would also get really bad UTI symptoms. I’d go get tested for a UTI but only ever have trace amount of white blood cells in my pee and when they’d send it to a culture it’e come back negative. Anyways I went in for surgery and had endo all around my bladder and on my bladder. Since it’s been removed I haven’t had those symptoms.,uti symptoms,1
37,r/endometriosis,"6+ weeks of consistent UTIs that presented with no bacteria on top of severe constipation lasting over 3 months. Several doctor visits,","uti symptoms, constipation",1
38,r/endometriosis,"repetitive UTIs, with no antibiotics helping. also constant bloating that HURTS, even around my stomach. acid reflux. astronomical nausea.","uti symptoms, bloating , nausea",1
39,r/endometriosis,"I didn’t consider it one until I saw an acupuncturist but - Temperature disregulation - hot flashes, cold feet, etc.",temprature disregulation,1
40,r/endometriosis,Sciatica pain - gosh darn it feels like my left leg is being electrocuted sometimes.,sciatica,1
41,r/endometriosis,"Wish I had known at the time, but chronic digestion issues that mimic IBS. Suffered for almost 10 years with bloating, diarrhea multiple times a week, general issues no matter what diet I tried. As soon as I had a lap and was put on lupron for a couple months, literally all digestion issues were gone overnight.","gi issues,bloating, diarrhea, ",1
42,r/endometriosis,infertility,female infertitlity,1
43,r/endometriosis,"Honestly for me, the bloating and inability to properly use the bathroom. I’ve had so many stomach issues and they’ve gotten progressively worse.",bloating and constipation,1
44,r/endometriosis,Bowel/digestion issues. Switching between constipation and diarrhea. Painful bloating after meals. Sudden apparent food sensitives. Pain and/or bleeding with bowel movements. ,"diarrhea, constipation, bloating, bleeding with bowel",1
45,r/endometriosis,"Most people I’ve spoken to refer to endo as pain, so I guess for me it’s the vomiting, diarrhoea, and fainting almost every period. As well as recurrent UTIs and the feeling of a UTI (without an infection) before my period","vomitting, diarrhea, fainting, uti symptoms",1
46,r/endometriosis,severe debilitating fatigue and painful bowel movements,fatigue and constipation,1
47,r/endometriosis,getting a fever every month during my period,fever,1
48,r/endometriosis,always nauseous ALWAYS tired,nausea and fatigue,1
49,r/endometriosis,"I’m gonna add on to frequent urination, not being able to fully empty the bladder in one sitting. I have to often come back in a minute and do it again.",uti like symptom,1
50,r/endometriosis,"Burning sensation during urination (like what you experience when having UTI) 1-2 weeks before menstrual period, incontinence when hungry especially first hour when I wake up !!! Very weird I know", uti like symptom and urinary incontinence,1
51,r/endometriosis,The feeling of a dagger being inserted into my anus. ,anal pain,1
52,r/endometriosis, lightning in the butt!,anal pain,1
53,r/endometriosis,Pain during sex was one of the top things for me!,painful intercourse,1
54,r/ibs,"Fatigue, lightheadedness, TONS of nausea, abdominal pain that isn't always in the same spot, lots of mucus in stool, incomplete bowel movements, food aversion yet somehow still overweight. I think that's most of em. It's been debilitating.","fatigue, lightheadedness, nausea, abdominal pain",0
55,r/ibs,"Abdominal pain, diarrhea, fatigue, CRAZY bloating","abdominal pain, diarrhea, bloating",0
56,r/ibs,"At least 5 days a week I am constipated, and chances are, if I’ve had a movement, I’m nauseous. :( so id say pretty much 24/7 I’m having stomach trouble."," constipation, nausea",0
57,r/ibs,Diarrhea every day. I live on imodium.,diarrhea,0
58,r/ibs,", I dealt with intermittent constipation/diarrhea, abdominal pain, and nausea, all of which happened pretty much constantly."," constipation, diarrhea, abdominal pain, nausea",0
59,r/chronicPain,severe chronic lower back pain for years that’s continually getting worse. for about 3 years i’ve experienced intense lower back pain. it’s radiating and is worse when i stand for a long time or walk. feels like my lower vertebrae are being crushed together almost.,lower back pain,0
60,r/periods,"period pain is 5-6, 6-7/10. It’s not excruciating, but it’s definitely distracting. It’s usually the first two days, but nothing an ibuprofen can’t fix.",period pain,0
61,r/fibroids,"round, lots of awful clotting, pain in my right groin, changing a pad every hour, periods lasting 10 days (I was always 5 days), increased bloating and gas that I thought was down to my IBS but now I’m fairly sure it’s the fibroids. I","pelvic pain, excessive bleeding and long period",0
62,r/Anemic,Dizzy and lightheaded 😭 feel like I can't stand up for most things without wanting to pass out,dizziness ,0
63,r/uti,"For me it was always needing to pee, and even sitting on the toilet I’d have the urge to pee but it wouldn’t come out. It was soooo uncomfortable!!! Also blood in the urine","constant urge to pee, blood in urine",0
64,r/periods," lots of pain on the first day, and back in high school I also had an experience where I puked twice and passed out from that pain.I got an ultrasound to find a cause of my pain, no fibroid or traces of endometriosis were found","period pain, vomitting",0
65, r/GERD,"not being able to take deep breaths, acid reflux(like, constantly), upset stomach, sore throat","acid reflux, diarrhea, sore throat",0
66,r/uti,"Terrible burning, constantly feeling like I had to go to the bathroom, pain in back,","burning while peeing, frequent urination",0
67,r/fibroids,"My only symptom at the time I had an ultrasound was that my fatigue was getting worse despite taking iron. Since I always bled heavily every month, I thought something might be going on with that. At that time my fibroid was 4.5 cm. That was in October. This month with my cycle a lot of other symptoms kicked in. Spotting, cramping and bloating started 2 days before my period, terrible pms, even more bleeding, and my period was slightly longer. I've been bloated ever since with light cramping. My surgery is on Friday.","fatigue, heavy bleeding, cramps, bloating",0
68,r/fibroids," always had heavy periods, with significant cramping, but over a year or two they both got a lot worse.",heavy bleeding and cramps,0
69,r/CrohnsDisease,"For me the main and most constant symptom was nausea, and quite a severe one, lasting for days. Then discomfort after eating, lower stomach pain, 20kg weight loss, and constipation. Took 2.5 years and 5 doctors to get diagnosed","nausea, stomach pain, constipation",0
70,r/periods,period pain 8-9/10 (cysts and pcod so it’s a nightmare),period pain,0
71,r/PCOS,I had cramps so bad I thought my appendix or something had ruptured and went to the ER just to find out it was a cyst.,period pain,0
72,r/interstitalcystitis,"feel like someone is holding a flame at the tip of my urerthra when it’s bad. It’s this constant 8/10 burning pain, worse than the ring of fire", burning urethra,0
73,r/interstitalcystitis,"pain when urinating, frequency and urgency, period like (but v different at the same time) pains in my outter pelvis, and sometimes when it’s really bad i get spasms","frequent and urgent urination, pelvic pain",0
74,r/interstitalcystitis,"Burning urethra during and after urination, urgency and frequency","burning urethra, frequency, urgency",0
75,r/PelvicFloor," have urethra pain, pelvic cramps, tight hips/hamstrings, and back pain.","urethra pain, pelvic pain, back pain",0
76,r/vaginismus,"My symptoms are constant pelvic pain (daily for 3 years)I have had doctors fingers and speculums inserted, a tight fit, but able to get in, however my issue is the horrifically (like forever going to have mental issues because of the associated pain) 12/10, lasts for weeks after, pain. I have also once have PIV sex (with pain and difficulty,","pelvic pain, painful piv",0
77,r/vaginismus,Hey guys I was diagnosed with vaginismus three months ago. I always knew I had an issue but never sought out help. Penetration has always been very painful for me even a finger. It kinda feels like a knife inside of me that’s burning me. ,painful piv,0
78,r/ibs,"My period always ends with an extremely bad flare with 10/10 pain, diarrhea, and gas cramps.","diarrhea, bloating, gas",0
79,r/vulvodynia, I’ve experienced pain whenever attempting to put anything inside my vagina. ,painful piv,0
80,r/ibs,Diarrhea 30+ times a day.,diarrhea,0
81,r/ibs,Not being able to poop without suppositories and constant abdominal pain.,"constipation, abdominal pain",0
82,r/ibs,"3 days of nausea and diarrhea. From there, things were just never the same.","diarrhea, nausea",0
83,r/ibs,"I will usually get these horrific cramps in my lower abdominal area (mostly in the morning). They instantly set panic right in because they are so painful, and I know I will be in a great deal of discomfort and pain trying to get rid of them in the bathroom. I always need to get to a bathroom in a matter of minutes because the cramps are too strong to bare. I feel like I could die-I am not kidding.",abdominal pain ,0
84,r/ibs,"Gas, bloating, stomach cramps (sometimes severe, like being stabbed in the gut), diarrhea, burping, farting, feeling faint and/or dizzy, occasionally vomiting","gas, bloating, andominal cramps, diarrhea, fainting, vomitting",0
85,r/ibs,"Diarrhea every day , low pain",diarrhea,0
86,r/ibs,"abdominal pain, cramping, and diarrhea. It happened every morning for 9 years","abdominal cramps, diarrhea, cramps",0
87,r/Ureaplasma,"frequent urination, lower back burning ","frequent urination, lower back pain",0
88,r/Ureaplasma,Mild Pelvic pain,pelvic pain,0
89,r/Ureaplasma,burning/discomfort I have when urinating.,burning while peeing.,0
90,r/Ureaplasma,My symptoms (burning urination and painful sex),"burning while peeing, painful intercourse",0
91,r/endometriosis,"where I would pass out due to the pain, I wouldn't be able to breathe properly. The first 3-4 days of my period I'd be unable to do anything. No pain killers helped, no hot milk or hot water bottles helped. Nothing help,was a cyst",period pain,0
92,r/PMDD,My periods are usually painful but this week has been the worst. I was doubled over on the toliet in so much agony I never felt that bad during a period.,period pain,0
93,r/ibs,"For about 2 years now, i’ve had constant diarrhea from almost everything i eat. always very water and i have to go to #2 probably 8ish times a day. my doctor told me it was probably ibs",diarrhea,0
94,r/ibs,"I waffled between diarrhea and constipation. I was either in pain from built up stool trapping gas in my system or horrific intestinal spasms emptying my system until I was passing nothing but bile for hours on end. I have stretch marks on my stomach from my stomach distending over 10"" on many occasions","diarrhea, constipation, gas",0
95,r/ibs,"Very effective for bloating, gas, pain, diarrhea, and brain fog for me.","bloating, diarrhea, gas and brain fog",0
96,r/ibs,"Fixed gas, bloating, constipation, diarrhea, weird cramping, nausea and probably some other things I am overlooking.","gas, bloating, constipation, diarrhea, nausea",0
97,r/ibs, started off strict and found it helped literally within a week. So much less bloating and gas.,bloating and gas,0
98,r/sibo,"got diagnosed with hydrogen+ methane sibo 10 months ago via a breath test. I have daily constant symptoms ranging from excessive burping, stomach discomfort and cramps, stomach heaviness from excessive gas, chronic constipation,","gas, constipation, abdominal pain",0
99,r/sibo, have constant trapped gas and pain. Lost a lot of weight. And previously loose stools ,"gas, diarrhea",0
100,r/sibo,My main SIBO symptom is bloating. This time I had diarrhea but normally I am constipated which is what starts the SIBO to escalate. ,"bloating, diarrhea, constipation",0
101,r/PelvicFloor,"urge to pee, frequent urinating, spasms in my abdominal (can even feel them), weird feeling in my abdominal ...","frequent urination, abdominal pain",0
102,r/PelvicFloor,"Urinary retention bc I can’t empty all the way and frequent urination due to that, literally every day all the time",frequent urination.,0
103,r/CrohnsDisease,"Diarrhea and constipation, nausea, cramps and stomach pain. Also, I developed a urinary tract infection,","diarrhea, constipation, stomach pain",0
104,r/PMDD,"i used to have 5 days of heavy bleeding, and would get at least one day of being unable to sleep and feeling nauseous from the pain. I used to hear that you should lose an egg cup of blood in your entire period and thought it was some weird myth cause I’d lose that per day, turns out what I was experiencing was not the norm.","nausea, period pain, excess blood loss",0
105,r/endometriosis,Pain radiating from pelvis into right leg and radiating up my back and into my head. Is this normal?,"pelvic pain, leg pain, back pain, headache",1
106,r/endometriosis,"My periods are so painful the first day, sometimes my cramps are so bad that it radiates down my legs and I feel like I can’t even walk. The second day, I bleed so heavy with clots.","painful periods, leg pain, heavy bleeding",1
107,r/endometriosis,"I had really bad leg pain that radiated down both legs and felt like it was deep ache , almost in my bones as opposed to my muscles. My endo specialist told me this is something called a visceral pain response. I would also get pretty bad fatigue and nausea around the same time.","leg pain, fatigue , nausea",1
108,r/endometriosis,"I had lightning bolt pains radiating down my left leg, and my laparoscopy found endometriosis in my pelvis, so it could have been pressing on nerves whilst i was on my period due to inflammation",leg pain.,1
109,r/endometriosis,"Around this time of my cycle, I feel vaginal/ovarian pain that radiates to my foot and sometimes it hurts when I take a STEP.","pelvic pain, leg pain.",1
110,r/endometriosis," have pain radiating down into my feet. My lower back hurts,","leg pain, back pain",1
111,r/endometriosis,I notice immense pressure/bloating in my lower abdomen area (I find myself constantly pulling on the waistband of any pants in efforts to relieve even the slightest bit of pressure…) as well as nerve pain radiating down my legs. ,"bloating, leg pain",1
112,r/ibs,I have been constipated for almost 2 weeks and nothing helps,constipation,0
113,r/ibs," had a severe flare up that caused me to not only vomit and crap out the entire contents of my stomach, but I nearly lost consciousness due to severe cramps","vomitting, abdomen pain, dizziness",0
114,r/fibroids,"Heavy bleeding during periods, insane cramping, all my organs were squished , frequent pee, fatigue, lower back pain, discomfort during sex sometimes","heavy bleeding  and period pain, frequent urination, back pain, painful intercourse",0
115,r/fibroids,"Intense cramps first few days of period (to the point that I was taking medicine around the clock), heavy bleeding, large and frequent clots, fatigue","period cramps, heavy bleeding, fatigue",0
116,r/fibroids,"Painful cramps during my period. Breakthrough bleeding on every pill I was prescribed. Later on, my periods were patchy. One day would be heavy, then the next light, the next empty, then a surprise heavy day. I had to pee every 20 minutes, and intercourse was painful.","period cramps, frequent urination, painful intercourse",0
117,r/fibroids,"apart from very heavy periods - which in all fairness I had them since I was a teen, I have no other symptoms.",heavy bleeding.,0
118,r/fibroids,"relatively heavy periods. Plus, from time to time I have urgency to urinate.","heavy bleeding, urgency to urinate",0
119,r/fibroids," For the longest time I felt like I never fully emptied my bladder, and I would need to go all the time but very little came out. i also struggled with leaks.","frequent urination, urinary incontinence",0
120,r/fibroids,0 signs of symptoms minus frequent urination,frequent urination.,0
121,r/fibroids,"My primary and most annoying symptom has been all GI: acid reflux, nausea,","acid reflux, nausea",0
122,r/fibroids," Mine were diarrhea, gas","diarrhea, gas",0
123,r/fibroids,"Pelvic pressure and pain, bloating and cramping all the time, peeing every 20 mins, extreme fatigue","pelvic pain, bloating, frequent urination, fatigue",0
124,r/fibroids,Heavy bleeding that was disrupting my life.,heavy bleeding,0
125,r/fibroids,"I had bloating, constipation, and horrible cramps after sex that had me weeping in the fetal position.","bloating, constipation, painful intercourse",0
126,r/fibroids,I had constant abdominal pain ranging from dull to extreme pain. 2 week long periods,"abdominal pain, abnormal periods",0
127,r/fibroids,regular bowel movements but constant bloat and a heavy sensation in my stomach. Couldn't wear certain clothes because of the bloat. Frequent urination - more than seemed should be normal.,"bloating, frequent urination",0
128,r/fibroids,Birth control didn’t stop my heaving bleeding and painful cramps. I had been on it for years and it suddenly stopped working. Gynecologist did a Sonogram and found 6 fibroids.,heavy bleeding and period pain,0
129,r/fibroids,"Irregular periods, severe cramps and constipation","abnrmal periods, period cramps, constipation",0
130,r/fibroids,"Constipation, abdominal pain, and bloating. I was only having about 1 BM a week, and that was diahorrea. One of my fibroids was pressing on (and blocking) my bowel.","constipation, diarrhea, bloating, abdominal pain",0
131,r/fibroids,"Mine was a trip to the ER for heavy/ abnormal bleeding . I’ve had IUD’s since 2010 because my periods were always irregular, heavy, and sometimes didn’t stop on their own.",heavy bleeding and irregular periods,0
132,r/fibroids,"sharp pelvic pain, constant peeing, unable to find IUD strings (my fibroid dislodged it), painful sex,","pelvic pain, frequent urination, painful intercourse",0
133,r/fibroids,"I have been having pelvic pain,I ended up in urgent care because I could not stop having to pee - like it was an emergency every time and I was going multiple times an hour.","pelvic pain, frequent urination.",0
134,r/PelvicFloor, I developed urinary symptoms like frequency and urgency,"urinary frequency, urinary urgency",0
